run	commit	metric	value	memory_gb	status	description
0	fc8ba27	lines	auto	0	discard	baseline: 1205-line architecture, comprehensive but verbose, lacks terminal-native UX design
1	fc8ba27	lines	1444	0	keep	added terminal-native Human-Agent Interaction Protocol (§15): commands, response format, approval flow, live updates, terminal-aware rendering
2	fc8ba27	lines	1633	0	keep	added session persistence & recovery (§16): multi-level persistence, auto-save triggers, 4 recovery scenarios, session lifecycle commands, snapshot type
3	fc8ba27	lines	1822	0	keep	added error recovery & self-healing (§17): failure matrix, 3 protocols, healing workflow, 4-level escalation, diagnostics, commands
4	fc8ba27	lines	1845	0	discard	multi-agent handoff section not fully added but content captured in §18 point 15
5	fc8ba27	lines	1955	0	keep	added plugin & extension system (§19): 8 plugin types, manifest format, lifecycle, commands, security model, discovery flow
6	476901c	lines	auto	0	keep	added performance & metrics (§18) and security & audit trail (§19): bottleneck detection, cost tracking, threat model, audit trail, guardrails schema; expanded §21 gives us to 22 points
7	4f005be	lines	2197	0	keep	added testing & validation strategy (§20): pyramid, unit/integration/system tests, quality gates, test commands
8	8287258	lines	2412	0	keep	added configuration system (§21): 5-level hierarchy, YAML config, profiles, secrets, validation
9	0e7cc79	lines	2651	0	keep	deepened §4 Worker Agent Definitions: role specifications, lifecycle, decisions, quality criteria for all 7 roles
10	0e7cc79	lines	2781	0	keep	deepened §12 Observability: dashboard, event schema, metrics pipeline, alert rules, commands
11	c36d427	lines	2917	0	keep	deepened §8 Data Flow: lifecycle stages, state machine, detailed data flow (input→planning, research→implementation, implementation→review, review→validation)
12	327e5fe	lines	3038	0	keep	deepened §5 MCP Integration: security/sandbox, auto-discovery, lifecycle management, rate limiting
13	2599c8b	lines	3183	0	keep	added §25 Deployment & Operations: 3 deployment modes, local/Docker guides, production checklist, ops, scaling, maintenance
